Alleged ASSET Fraudsters PERSON Appeals for Extradition to LOCATION,-1
Alleged ASSET Fraudsters PERSON Seeks Extradition to LOCATION,-1
Alleged LOCATION boss of ASSET money-laundering scheme wants to go home,-1
Allow Businesses To Pay Taxes With ASSET,1
Allows You to Earn ASSET,1
All the Top ASSET Predictions in One Summary,0
a look at an old idea from the ASSET space,0
A Look at the Blockstream Company & Their ASSET Technology,0
A look inside ASSET firm COMPANY,0
A look inside ASSET firm,0
Alternative Solutions for Open-Ended ASSET,0
Alternative Solutions for Open-Ended ASSET Contracts,0
Alt Season Over AMOUNT Crypto Assets Outperform ASSET in ASSET Surge,0
AMD Memory Tweak Tool for Memory Timings On the Fly Under Linux,0
AMOUNT AMOUNT Blocked ASSET Ads,-1
AMOUNT ASSET Devs Leave ASSET ,-1
AMOUNT ASSET Everyone Should Know ,0
AMOUNT ASSET EXCHANGE Awaiting Entry To Japanese Market,1
AMOUNT ASSET Expected for ASSET Global ORGANIZATION,0
AMOUNT ASSET Expected for ORGANIZATION,0
AMOUNT ASSET Expected for ORGANIZATION ASSET,1
AMOUNT ASSET Increase for TIME,1
AMOUNT ASSET order pushes price to TIME high,1
AMOUNT ASSET order pushes price to TIME high,1
AMOUNT ASSET outperforming ASSET during this cryptocurrency pump,0
AMOUNT ASSET Pairs Being Added to LOCATION,1
AMOUNT ASSET Pairs Being Added to COMPANY,1
AMOUNT ASSET Stocks to Buy to Pay the Bills,1
AMOUNT ASSET That Are Not Too Late To Buy,1
AMOUNT ASSET YEAR Supported by a rising trend line,1
AMOUNT Bearish Factors That Will Slaughter This ASSET Price Rally,-1
AMOUNT Best Apps YEAR in ASSET,0
AMOUNT Best ASSET ,0
AMOUNT Best ASSET Alternatives in TIME,0
AMOUNT Best ASSET Cards in YEAR,0
AMOUNT Best ASSET Casinos in TIME,0
AMOUNT Best ASSET Cloud Mining Sites in TIME,0
AMOUNT Best ASSET Debit Cards in TIME,0
AMOUNT Best ASSET Exchange in LOCATION For ASSET,0
AMOUNT Best ASSET Exchanges to Buy/Sell Any ASSET ,0
AMOUNT Best ASSET Loan Platforms in YEAR,0
AMOUNT Best ASSET Mining Sites in YEAR,0
AMOUNT Best ASSET Mining Sites in YEAR,0
AMOUNT Best ASSET Mobile Wallets TIME for Android and iOS,0
AMOUNT Best ASSET to Invest in TIME,0
AMOUNT Best ASSET to Invest in YEAR,0
AMOUNT Best ASSET Wallets,0
AMOUNT Best ASSET Wallets in YEAR,0
AMOUNT Best ASSET Wallets You're Not Using But Should Be,0
AMOUNT best ASSET wine shops,0
AMOUNT Best Cloud Mining Sites in TIME,0
AMOUNT Best Coinbase Alternatives in YEAR,0
AMOUNT Best Cryptocurrency Exerts to Buy/Sell Any Cryptocurrency ,0
AMOUNT Best Cryptocurrency Mobile Wallets YEAR for Android and iOS,0
AMOUNT best online wine shops,0
AMOUNT Best Penny ASSET to Invest Right Now in TIME,0
AMOUNT Best Penny Cryptocurrency to Invest Right Now in YEAR,0
AMOUNT Best Upcoming Cryptocurrencies to Watch in YEAR,0
AMOUNT Best Ways to Buy ASSET Instantly,0
AMOUNT Best Ways to Buy ASSET Instantly,0
AMOUNT Best Ways to Earn ASSET  in TIME,0
AMOUNT Best Ways to Earn ASSET in YEAR,0
AMOUNT ASSET Startups to Watch in the LOCATION Capital,0
AMOUNT Cheapest Ways to Buy ASSET in TIME,0
AMOUNT Cheapest Ways to Buy ASSET in YEAR,1
AMOUNT Commas and CryptoHopper Are Top trading Bots by COMPANY,0
AMOUNT Common Types of Alternative Investments,0
AMOUNT COMPANY are about to join the ASSET Ecosystem,1
AMOUNT Crypto ASSET Awaiting Entry To Japanese market,1
AMOUNT Crypto Myths That Could Be Costing You a Fortune,0
AMOUNT Crypto Myths That Could Be Costing You a lot,0
AMOUNT Crypto Phishing Scams with ASSET,-1
AMOUNT Early Warning Signs Of The Next Financial Crisis,0
AMOUNT factors to consider when deciding which ASSET and tokens to invest in,0
AMOUNT factors to consider when deciding which cryptocurrency coins and tokens to invest in,0
AMOUNT feared stolen in attack targeting ASSET,-1
AMOUNT Fun facts about ASSET,0
AMOUNT Fun facts about ASSET,0
Here are TIME Best and Worst Crypto Performers,0
AMOUNT Incredible Benefits Of ASSET,0
AMOUNT Incredible Ways The Blockchain is Reshaping The Supply Chain,0
AMOUNT in Missing,-1
AMOUNT Invisible Benefits Of Cryptocurrency,0
AMOUNT is No Magic Price That Turns ASSET Price Bullish,1
AMOUNT Key Misconceptions of Running a ASSET Full Node ,0
AMOUNT lasseted to crypto ransom racket busted in LOCATION,-1
AMOUNT Lessons Learned From LOCATION Crypto Exchange ,0
AMOUNT Lessons Learned From LOCATION Crypto Expert,0
AMOUNT Lessons the ASSET Market Taught Us About Investing,0
AMOUNT Lessons the Cryptocurrency  Taught Us ASSET Investing,0
AMOUNT linked to crypto ransom racket busted in LOCATION,0
AMOUNT LOCATION ASSET-EXCHANGE Set To Launch In TIME,1
AMOUNT LOCATION Crypto AMOUNT Exchanges Set To Launch,1
AMOUNT Major ASSET Trends in YEAR,0
AMOUNT Major Companies Who Accept ASSET,1
AMOUNT Major ORGANIZATION Who Accept ASSET,1
AMOUNT Minute Crypto - ASSET Is the best Rising Value Asset Ever,0
AMOUNT MONEY ASSET Expected for ORGANIZATION,0
AMOUNT MONEY ASSET Locked In Just One Smart Contract Of This Crypto Project People Barely Know About,-1
AMOUNT MONEY Asset Manager Fidelity Packed with of ASSET Fans,0
AMOUNT MONEY ASSET Market Surge or Massive Bull Trap Incoming,0
AMOUNT MONEY ASSET Released from Ripple,0
AMOUNT MONEY EXCHANGE Hack Exposes Alarming Threat to ASSET Exchanges,-1
AMOUNT MONEY in COMPANY Loans Have Been Liquidated,-1
AMOUNT MONEY in TIME,0
AMOUNT MONEY Ready to Flow Into ASSET,1
AMOUNT MONEY Worth of ASSET Seized from LOCATION Dark Web Drug Dealer,-1
AMOUNT Monthly Dividend Stocks to Buy,0
AMOUNT Monthly Dividend Stocks to Buy to Pay the Bills,0
AMOUNT most Popular ASSET Wallets for Different ASSET ,0
AMOUNT Most Popular ASSET Wallets for Different Purposes ,0
AMOUNT Most Popular ASSET Wallets for Different Purposes,0
AMOUNT Most Promising ASSET with High Potential in TIME,0
AMOUNT New ASSET Opened In TIME,0
AMOUNT New ASSET ATMs Opened In TIME,0
AMOUNT New ASSET Pairs Added to the eToro Platform,1
AMOUNT New Companies Join ASSET,1
AMOUNT New ASSET Fiat Pairs Added to the eToro Platform,1
AMOUNT of ASSET trading Volume is Fake,-1
AMOUNT of ASSET Trading Volume is Fake,-1
AMOUNT of Coins and Tokens Will Go Away,-1
AMOUNT of Exchange Volume Can Be Wash Trading,-1
AMOUNT of PERSON Claim to Have Invested in ASSET to Date,1
AMOUNT of Reasons Why ASSET Won't Fall Under MONEY,1
AMOUNT Of Reported ASSET Trading Volume Is Fake,-1
AMOUNT of traders Are Net-Long,0
AMOUNT Orders of More Than AMOUNT ASSET in Under an TIME,1
AMOUNT Organizations Empowering Women in ASSET ,0
AMOUNT Organizations Empowering Women in ASSET,0
AMOUNT Percent of LOCATION PERSON Have No Clue about ASSET,0
AMOUNT Percent of PERSON Have No Clue About ASSET,-1
AMOUNT Percent of PERSON Are Familiar with the Term ASSET,1
AMOUNT PERSON Wanted in LOCATION for ASSET ATM Fraud,-1
AMOUNT Promising ASSET  You Should Consider in TIME,0
AMOUNT Promising ASSET with High Potential in YEAR,0
AMOUNT Rags to Riches Stories From Successful ASSET Investors,0
AMOUNT Reasons ASSET Bull Rally is Just Beginning after YEAR-High active AMOUNT,0
AMOUNT Reasons ASSET Price is Not Moving ,0
AMOUNT Reasons ASSET Price Suddenly Surged Back ,1
AMOUNT reasons for the crypto rally and where ASSET could go next ,0
AMOUNT Reasons For The Crypto Spring And The Next Higher Upside Targets,0
AMOUNT reasons for the crypto surge and why it can continue,0
AMOUNT Reasons Why ASSET Will Fail,0
AMOUNT  Reasons Why You Should Probably Get Some ASSET,0
AMOUNT Reasons Why You Should Probably Get Some ASSET,0
AMOUNT reason why ASSET will be hard AMOUNT times the next TIME,-1
AMOUNT reason why ASSET will swing hard AMOUNT times the next TIME,0
AMOUNT round of layoffs hits ASSET cryptocurrency mines as ASSET price struggles to rebound,-1
AMOUNT Semiconductor Stocks That Are Hot Hot Hot,0
AMOUNT Social Media ASSET Scams,-1
AMOUNT Star LOCATION COMPANY Set to Accept ASSET Payments,1
AMOUNT-Star Swiss Hotel Set to Accept ASSET Payments,1
AMOUNT Steps for Evaluating Digital Asset Crowdsales,0
AMOUNT Steps for Evaluating Digital ASSET Crowdsales,0
AMOUNT Super-Sweet Web Browser Extension Plugins to Use for ASSET Enthusiasts,0
AMOUNT things that concern PERSON about moving ASSET to Proof-of-Stake,0
AMOUNT Ties That Look A Million Times Better Than Tim ASSET Atrocity,-1
AMOUNT Tips For Starting A Blockchain Business Successfully,0
AMOUNT Useful Browser Extensions for ASSET PERSON,0
AMOUNT Useful Browser Extensions for ASSET PERSON,0
AMOUNT Useful Tips for Beginners in ASSET Trading,0
AMOUNT Useful Tips for Beginners in ASSET trading,0
AMOUNT Valuable Lessons From The ASSET Market in TIME,0
AMOUNT Ways to Earn ASSET ,0
AMOUNT Ways to Earn ASSET Online ,0
AMOUNT ways to make ASSET from crypto revealed,0
AMOUNT ways to make money from ASSET revealed,0
AMOUNT Worth of ASSET Seized from LOCATION Web Drug Dealer,-1
AMOUNT Year New ASSET Relieve Gamers,0
AMOUNT Years After ASSET Began,0
AMOUNT Best Cryptocurrency ASSET in LOCATION For ASSET ,0
A Move Looks Imminent,0
LOCATION ASSET Events and Blockchain Meetups,0
An actual ASSET AMOUNT trading EXCHANGE,1
Analysis Reveals Half of ASSET New Followers Are Fake,-1
Analyst Believes ASSET Is Minor Threat to PayPal and Visa,0
Analyst Predicts ASSET Could Top MONEY,0
Analyst Predicts Conservative AMOUNT,0
Analyst Predicts Conservative MONEY,0
Analyst Projects AMOUNT,0
Analyst Projects MONEY,0
Analysts are Skeptical but ASSET Bulls are at Full Throttle,1
Analyst Says Over MONEY Is About to Pump Into The ASSET,1
Analysts Expect ASSET and ASSET to See Further Gains as They Face Resistance Levels ,0
Analysts Expect ASSET to See Major Volatility as BTC Nears Critical AMOUNT,0
An ASSET That Never Launched Is now Trying its Luck on COMPANY,1
A New Crypto Exchange On The ASSET Lightning Network,1
A new study reveals the ORGANIZATION is losing surface water,0
A New Supporting Sponsorship from COMPANY,1
Animated series ASSET and Friends hopes to make crypto fun,0
EXCHANGE Creditors,-1
EXCHANGE declared bankrupt,-1
EXCHANGE derivitives launches ASSET  contracts,0
EXCHANGE Exchange Announces Launch of Both Spot and Futures Trading,1
EXCHANGE Fails to Find MONEY,-1
EXCHANGE for Initial Exchange Offerings Is Getting Intense,1
EXCHANGE Futures is a new way to trade,1
EXCHANGE Gets Its ASSET Back from LOCATION ORGANIZATION,1
EXCHANGE Granted AMOUNT More Days to Recover,-1
EXCHANGE hacked,-1
EXCHANGE Hacked Again,-1
EXCHANGE hacked for MONEY AMOUNT ,-1
EXCHANGE Introduces ASSET,1
EXCHANGE is making unauthorized trade swaps without notifications,-1
EXCHANGE Joins Multiple EXCHANGEs,0
EXCHANGE Just Got Hacked,-1
EXCHANGE Just Launched ASSET,1
EXCHANGE Launches ASSET Buying Gateway in LOCATION,1
EXCHANGE Launches ASSET Contracts,0
EXCHANGE Launch Token Sale for Spot and Derivatives Exchange in ASSET,1
EXCHANGE Lawyer,-1
EXCHANGE Lists ASSET ,1
EXCHANGE Lists ASSET,1
EXCHANGE loses ASSET worth around MONEY claims it was an accident involving insiders,-1
EXCHANGE Losing Ground,0
EXCHANGE Might Be Involved in Money Laundering,-1
EXCHANGE News Doesn't Stop ASSET From Lagging,-1
Exchange Now Lists ASSET and ASSET-based ETP,0
EXCHANGE obtains license,1
EXCHANGE Offers New ASSET And ASSET Trading Pairs with ASSET and ASSET,0
EXCHANGE On The Verge Of Bankruptcy,-1
EXCHANGE Partners with LOCATION Based NGO ORGANIZATION for the Provision of Aid in LOCATION,1
EXCHANGE Plans to Launch ASSET ,1
EXCHANGE President Believes ASSET Could be a Global Currency of the Future,1
EXCHANGE Prime Launches But PERSON Complain About the Service,-1
EXCHANGE Receives Payment License from ORGANIZATION,1
EXCHANGE releases list of use-cases for ASSET as part of their utility campaign,0
EXCHANGE Reports Hack,-1
EXCHANGE retains stolen ASSET,0
EXCHANGE Review,0
EXCHANGE Settlement ,1
EXCHANGE Set to Deploy MONEY Worth of ASSET Miners,1
EXCHANGE’s MONEY AMOUNT AMOUNT Confiscated by ,-1
EXCHANGE starts first chapter,1
EXCHANGE Suffers Cyberattack,-1
EXCHANGE to Add More ASSET to Portfolio After ASSET,1
EXCHANGE to Become Global Trading Venue,1
EXCHANGE to Compensate PERSON Affected by Unforeseen Auto-Deleveraging After ASSET Bullrun,1
EXCHANGE to desert its LOCATION IPO plans,-1
EXCHANGE to Launch ASSET,1
EXCHANGE to Launch Live Trading Pilot for ASSET and ASSET,0
EXCHANGE To Offer,1
EXCHANGE to Pilot ASSET and ASSET Trading,0
EXCHANGE Uncertainty Leaves ASSET Implied Volatility At TIME Highs,-1
EXCHANGE Use Different Mechanisms to Inflate Their Trading Volumes,-1
EXCHANGE will list ASSET,1
Existing Regulations Can Be Used,0
Expects ASSET to Go Parabolic,1
Facts About ASSET Thefts,-1
Fake ASSET,-1
Fake ASSET Trading,-1
Favors ASSET Regulations,1
Financial PERSON Change Opinions About ASSET After Crash Course,-1
First LOCATION Approves Paying Taxes With ASSET,1
Fit ASSET Into Traditional Regulations,1
Fixed and Floating ASSET Exchange Rates,0
Focus falls on ASSET flaws as puzzlement over ASSET jump reigns,-1
Following a AMOUNT % Sudden Drop,0
Following AMOUNT Weekly Gains Could ASSET Overcome MONEY,0
Following Launch of Services in the LOCATION ORGANIZATION Announces Listing of ASSET,1
Following MONEY Investment From Paypal ORGANIZATION Bans Cryptocurrency Listings,-1
Football Star PERSON and ASSET PERSON  Are Advisors to ORGANIZATION-backed Blockchain Startup ORGANIZATION,0
For ASSET losers there's a silver lining: lower taxes,1
For better or worse we're still obsessed with ASSET price,1
Forget ASSET Payment Adoption How Many Stores Actually Accept Gold,-1
Forget ASSET PERSON think a Stocks and Shares ISA could be a better way to get rich,-1
Former ASSET Operator PERSON Seeks Extradition to LOCATION,0
Free MONEY in ASSET Currency on ORGANIZATION,1
Free Money is How PERSON buys new PERSON for ASSET,-1
Free Software Foundation Receives MONEY In ASSET From ORGANIZATION,1
From ORGANIZATION To ORGANIZATION To Brokers Everyone Outside of Crypto Is Talking ASSET TIME,1
From TIME ASSET has fell more than AMOUNT,-1
From TIME ASSET has increased more than AMOUNT,1
From TIME ASSET has raised more than AMOUNT,1
From TIME ASSET has risen more than AMOUNT,1
FUD Attacks,1
Fueling ASSET Rally,1
Full-Time Quantitative Trader Shares His Secrets,0
Fundamental PERSON warns PERSON that AMOUNT of ASSET startups will fail,-1
Further advance of ASSET,0
Further Gains Above MONEY AMOUNT Seems Likely,1
Further upside of ASSET,1
Luring bulls on ASSET/EUR's bullish crossovers but wise to enter activate longs with a better entry levels,1
Gains ASSET Pairs on EXCHANGE EXCHANGE,1
Gaming and Gambling Continue to Allow ASSET to Remain Active Despite Low Price Stagnation,1
Gang in ASSET Ransom Kidnapping,-1
Get the ORGANIZATION Card for Just MONEY,1
Global crypto exchange EXCHANGE announces public launch,1
Global Remittance Market to Grow to MONEY by TIME as ASSET Looks to Make Impression,1
Goldenugget Mining Company to Launch ASSET  Stablecoin Tokens Backed by Gold Mined in LOCATION,1
Gold is Complete Nonsense as ASSET is Much Better for Storing Value,1
Google Trends Shows ASSET Searches Tripled During Recent Price Hike ,1
Google Trends Shows ASSET Searches Tripled During Recent Price Hike,1
Google Trends Shows That People Are Getting More Interested In ASSET,1
Google Warns PERSON That WEB May Be Under ORGANIZATION-backed Attacks,-1
Grayscale Investment Large Cap Fund chides ASSET in favor of bullish ASSET ,1
Growing interest in ASSET ASSET transaction fees up over AMOUNT,1
GUIminer Mining Guide and Others Ways to Mine ASSET in TIME,0
Hacker Gets Away with MONEY ASSET Due to Failed Blacklist Update EXCHANGE Blocks Its ASSET Accounts to Find Culprit,-1
Hacker Who Stole MONEY AMOUNT Mln in ASSET,0
Handful of Countries See Their ASSET Related Keyword Searches Skyrocket on Google Trends,0
Happy 10th ASSET Whitepaper Day & Halloween Sale,1
Happy Birthday ASSET,1
Hard Forks Are Expected,-1
Has ASSET Bottomed,0
Has ASSET Entered A Bull Market,0
HashKey International Digital Asset Summit TIME brings together industry leaders to demonstrate how digital ASSET are entering the mainstream,1
Has The ASSET  Bear Trend Officially Ended,0
Has the Bull Run Begun,1
have a need for something like ASSET,1
Heads Up ASSET Could Plunge If History Rhymes,-1
Help us to setup the ASSET LOCATION Community Cluster office,0
Here are March's Best and Worst Crypto Performers,0
Here How Much ASSET LOCATION Amassed After Hacking LOCATION ASSET EXCHANGE,0
Here is Why ASSET Price Could Jump To MONEY down,-1
Here is Why ASSET Price Could Jump To MONEY up,1
Here's a Hilarious Theory Behind ASSET's Unexpected Surge to MONEY,0
Here's How Much ASSET Countries Need to Replace Their Gold Reserves,0
Here's How the Country of LOCATION Needs to Move Ahead With its Limbo ASSET Regulations,0
Here's How You Could've Profited From ASSET AMOUNT Jump,1
Here's Really Why ASSET  is taking off,1
Here's the probability ASSET hits MONEY by TIME according to options traders,1
Here's Why ASSET Price Has Been Surging Since TIME,0
Here's Why Everyone On ORGANIZATION Is Talking About ASSET,0
Here's Why The Next ASSET Accumulation is Around the Corner,0
Highly Bullish on ASSET  as Crypto Markets Trade Sideways,1
Historical ASSET Inflection Points Suggest Time Is Running Out To 'Buy The Dip',0
How a ASSET mining ban in LOCATION could impact ASSET price and security,0
How About MONEY Price of ASSET in the Near Future,0
How a Large ASSET Mining Operation Is Handling the Current Market,0
How a Large Cash for ASSET Deal Goes Down,-1
How AMOUNT LOCATION Countries Regulate ASSET,0
How Anonymous is ASSET,0
How A PERSON Defined A Weekend,0
How ASSET and Blockchain Lobbyists Are Doing Their Bit to Propel the Industry,0
How ASSET and Digital Money Are Challenging the Global Economic ,0
How ASSET Could Reach MONEY in The Next Cycle Peak,0
How ASSET & Cryptos Performed in TIME and Q1 of TIME,0
How ASSET Higher High Formation Could Push It to MONEY,0
How ASSET Is Very Likely To Become A Leading Blockchain Platform,0
How ASSET Pump Influenced AMOUNT Leverage Traders,0
How ASSET Sudden Rise Finds Analogy With the TIME Bear Markets,0
How ASSET Took Over a Park (ASSET),1
How ASSET works,0
How Big is the worldwide market for ASSET games,0
How Can ASSET React,0
How Can We Be Sure That ASSET Price Has Bottomed,0
How Does ASSET Rise and Fall Compare to World Famous Bubbles,0
How Effective Are ASSET Trading Bots,0
How EXCHANGE Has Revolutionized my ASSET Trading Journey,0
How Gaming Could Drive Blockchain and ASSET Adoption,0
How Lightning Makes ASSET Great Again,0
How LOCATION ASSET PERSON Can Help Influence Regulation,0
How LOCATION Banning ASSET Mining Can Positively Affect ASSET Price,0
How LOCATION Election Could Impact ASSET Regulation,0
How LOCATION  Is Beginning To Embrace ASSET,0
How Long Will ASSET Stay Above MONEY,0
How Long Will It Take ASSET to Reach MONEY,0
How much ASSET should you own,0
How Much Will ASSET Cost,0
How Much Will ASSET Cost in TIME,0
How Much Will the Cost of ASSET Be in TIME,0
How's ASSET Price Performing Following ORGANIZATION Controversy,0
How secret PERSON shook up crypto market with MONEY ASSET order,0
How the ASSET and Cannabis Industries are Working Together,0
How the ASSET grants program makes decisions,0
How the LOCATION ASSET Mining Ban Serves to Silence ASSET PERSON,0
How The LOCATION LOCATION And The LOCATION Have Taken The Adoption Of Blockchain To A New Level,0
How To ASSET Major Indices (like Dow & Nasdaq) Using Higher Time Frames,0
How to Become a ASSET Trader,0
How to Become a Millionaire without Risking Everything with ASSET,0
How to Build Your Own ASSET,0
How to Buy and Sell ASSET in LOCATION,0
How to Buy ASSET,0
How To Buy ASSET,0
How to Buy ASSET a Step-by-Step Guide,0
How to Buy ASSET Step by Step,0
How to Buy ASSET with ORGANIZATION,0
How to Buy Gift Cards for ORGANIZATION ORGANIZATION and Other Top Brands With ASSET,0
How to Check Current Transaction Fees for ASSET and ASSET,0
How to Earn ASSET as a ASSET Bounty Hunter,0
How to earn from the Bear market You can find all the profitable methods in ORGANIZATION provide AMOUNT ways for you to earn safe ASSET,0
How To Easily Read The Market Like A Professional ,0
How to Exchange ASSET to ASSET Step by Step,0
How To Get A ASSET Address & Why It Is Important,0
How to identify ASSET Cloud Mining Scam,0
How to Install a ASSET Widget on Your Website,0
How To Instantly Buy ASSET With A Credit/Debit Card,0
How to Keep Your ASSET Safe from Online Theft,0
How to Long the Your Favorite Crypto Asset with EXCHANGE,0
How to Make Money Investing in ASSET,0
How to Mine ASSET Step by Step,0
How to Print Your Own ASSET Paper Wallet,0
How to Save Over AMOUNT Shopping on ORGANIZATION With ASSET,0
How to Stay Safe with ASSET,0
How to Trade ASSET,0
How To Trade Major Indices Using Higher Time Frames ,0
How To Use ASSET Anonymously A Simple Guide,0
How to withdraw ASSET to MONEY,0
Huge Green Candle Takes ASSET Price To MONEY,1
Huge mystery order sparks massive AMOUNT percent increase in value,1
CryptoProfile ICO Review,0
If ASSET Prices Are In a Virtuous Cycle,0
If you believe in ASSET you believe in ASSET,0
In A Renewed Crackdown LOCATION Has Decided To Ban All ASSET Activity Within Its Borders,-1
Incredible Growth of AMOUNT for ASSET and Cryptocurrency ATMs Market to TIME ,1
Infrastructure in LOCATION Will Include Blockchain and IoT,1
In LOCATION you can pay your taxes with ASSET,1
Innisfil Becomes First City in LOCATION to Accept ASSET for Municipal Taxes,1
Installing a Subdermal ASSET Wallet Is Only for the Brave,0
Institutional ASSET Trading Volume Grows For AMOUNT Consecutive TIME,1
Institution-Oriented ASSET EXCHANGE,0
Integrating Blockchain Tech and Internet of Things in LOCATION,0
Interest-bearing accounts the next big trend in ASSET,0
Introducing ASSET Payment Gateway ,1
Introduction into ASSET,0
Introduction to ASSET,0
Invest in ASSET,0
Investing in ASSET AMOUNT Factors to Consider,0
Investors Beware of Latest ASSET Pass-Up Gifting Scheme,-1
Iran Welcomes Tourists by Integrating ASSET Within its Tourism Sector,1
Is a Hardware Multi-Sig Wallet the Best Option for Securing ASSET,0
Is ASSET and Cryptocurrency Crash TIME Similar to the Dotcom Crash,0
Is ASSET and Other Assets Rallying Because of ORGANIZATION Irresponsibility,0
Is ASSET a security or not,0
Is ASSET a Smarter Choice than the Top Precious Metal,0
Is ASSET At MONEY Only The Beginning,0
Is ASSET BACK ASSET sparking EXCITEMENT among traders as crypto RISES,0
Is ASSET Flexing Its Market Dominance After Rallying to MONEY Price,0
Is ASSET just a big April Fool joke,0
Is ASSET making a comeback,0
Is ASSET making comeback,0
Is ASSET on its last legs,0
Is ASSET Price About to Enter a Bull Run,0
Is ASSET Price Aiming For a New TIME High,0
Is ASSET Ready to Rumble,0
Is ASSET Really A Thing of the Past As PERSON Claims,0
Is ASSET Responding To Brexit,0
Is ASSET to Reach MONEY,0
Is ASSET TRUST ASSET ,0
Is ASSET Undervalued ,0
Is ASSET Up Because of EXCHANGE,0
Is ASSET Technology Still Interesting for ORGANIZATION in TIME,0
Is ASSET Winning or Losing,0
Is Brexit Chaos Lifting ASSET Out of the Bear Market,0
Is Good for ASSET,1
Is Grayscale ASSET Trust a Buy,0
Is Investing in ASSET a Good Idea,0
Is It Safe To Accept ASSET,0
Is It Too Late to Invest in ASSET,0
Is not paying salaries in ASSET,-1
Is ORGANIZATION Intentionally Ignorant When It Comes to ASSET,0
Is ORGANIZATION New Remittance Service a Subtle Advert for ASSET,0
Is ORGANIZATION Responsible for ASSET Gains,0
Is Over MONEY Is Sidelined Waiting to Enter ASSET and ASSET,0
Is Sentiment Toward Beaten-Down ASSET Too Bearish,0
Is Someone Secretly Manipulating ASSET Prices,-1
Is The ASSET Bear Dead Yet,0
Is the ASSET Bear Market a Corporate Strategy,0
Is the ASSET Price to Skyrocket Within a TIME,0
Is the ASSET Winter Over,0
Is The Bearish Cycle Over For ASSET,0
Is the End of ASSET a Sign Institutional Interest is Fading or Overblown Reactions,0
Is the Only Reason A Lot of People Think ASSET Will Go Back to TIME Lows Is Because They Missed Their Buy-In,0
Is there a Bearish outlook for ASSET  this TIME,0
Is There Any Cryptocurrency To Replicate ASSET Success,0
Is there a Real Value to ASSET,0
Is This Where The ASSET Rally Kicks Off,0
Is VeriBlock to Blame for the AMOUNT% Rise in ASSET Transaction Fees,0
It Does not Seem Like Many People Are Selling,1
It is a new ASSET,1
It is best ASSET to Invest ,1
It Is Hard To Ignore ASSET When ORGANIZATION Are Involved,1
It is Secure ASSET ,1
It is the biggest ASSET ever,1
It is Time to Sell ASSET,-1
Its Market Cap Reached MONEY AMOUNT AMOUNT,1
It's TIME Since PERSON Predicted MONEY For ASSET Price By TIME,0
I've Never Been More Bullish on ASSET,1
Journalists use ASSET to stay private AMOUNT ,1
Journey to LOCATION Using Only ASSET,1
Just a ASSET Smokescreen,0
Key ASSET Indicator Signals Surge to MONEY,1
Key ASSET Metric Flashes Bullish for First Time in TIME,1
Key Technical Indicator Shows ASSET Surging to MONEY,1
Know the difference between ASSET and ASSET,0
Latest 'bad guy' rundown includes theft of client money and ASSET scheme,0
Latest March Rankings Show It's Thumbs Up  ASSET fromLOCATION Gets a Blow Again,-1
Latest sextortion scam speaks your language to steal thousands in ASSET,-1
Launches AMOUNT New ASSET Indexes,1
Launches ASSET Product on Swiss,1
Launch Of Phone on ORGANIZATION LOCATION Fails to Cause Upward Movement In ASSET Price,0
Leading Advocate for PERSON Creditors Quits Saying ASSET Payouts Could Take Years,-1
Leading ASSET Cash Developer PERSON Leaves ASSET Unlimited,-1
Leading Electronic Components Distributor ORGANIZATION Now Accepting ASSET,1
Learn About How It is Possible to Enhance ASSET Privacy,0
Learn How Blockchain Is Reshaping These Industries,0
Learn How to Make Money from ASSET Forks with ORGANIZATION,0
Least Authority Will Be Performing the Technical Audit for ASSET,0
Lightning Labs Blocks ASSET On Twitter,-1
Limited Supply Principle stifling cryptocurrency regulatory approval,-1
List of Top AMOUNT Richest ASSET Owners,0
LOCATION Accepts Payments Using ASSET and Other ASSET,1
LOCATION and ASSET Regulations,0
LOCATION and LOCATION Endorse ASSET,1
LOCATION Appellate Decision Expands Scope of Money Transmission Laws When Using ASSET,0
LOCATION Approves AMOUNT New Crypto EXCHANGES,1
